{"schema":"jero-ai.review-verification-evidence/v2","version":2,"lineage_id":"review-evidence-example","authority_revision":"sha256:1111111111111111111111111111111111111111111111111111111111111111","target_identity":"sha256:2222222222222222222222222222222222222222222222222222222222222222","candidate_tree":"3333333333333333333333333333333333333333","paths_digest":"sha256:4444444444444444444444444444444444444444444444444444444444444444","paths":["internal/review.go"],"ledger_ids":["R3-001"],"raw_payload_sha256":"sha256:fbaacd1df6f28aa2ed91cd75533e1fb2844323408cf6057423cae3e0387ea0dc","raw_payload_bytes":20,"outcome":"passed","record_digest":"sha256:f89d690f641098c5769b89923606511103ef5e02550512f7762f202aa4c6ab32"}
